{
  "studentCharacterId": "student-fixture-month",
  "character": "月",
  "status": "available",
  "comparablePracticeCount": 4,
  "requiredPracticeCount": 0,
  "recentAverage": 65,
  "stabilityScore": 55,
  "monitoring": {
    "status": "monitoring",
    "reasonCodes": ["LOW_RECENT_AVERAGE", "LOW_STABILITY"],
    "enterThreshold": 70,
    "exitThreshold": 80,
    "ruleVersion": "fixture-monitor-v1",
    "enteredAt": "2026-08-11T10:00:00Z",
    "exitedAt": null
  },
  "segments": [
    {
      "scoreVersion": "fixture-score-v1",
      "glyphVersion": "fixture-songti-v1",
      "points": [
        {
          "practiceId": "practice-month-1",
          "sequence": 1,
          "assessedAt": "2026-08-08T10:00:00Z",
          "totalScore": 72,
          "dimensions": {
            "strokeStandard": 76,
            "frameStructure": 70,
            "glyphProportion": 74,
            "positionLayout": 68,
            "stability": null
          }
        },
        {
          "practiceId": "practice-month-2",
          "sequence": 2,
          "assessedAt": "2026-08-09T10:00:00Z",
          "totalScore": 68,
          "dimensions": {
            "strokeStandard": 72,
            "frameStructure": 66,
            "glyphProportion": 71,
            "positionLayout": 63,
            "stability": null
          }
        },
        {
          "practiceId": "practice-month-3",
          "sequence": 3,
          "assessedAt": "2026-08-10T10:00:00Z",
          "totalScore": 64,
          "dimensions": {
            "strokeStandard": 70,
            "frameStructure": 63,
            "glyphProportion": 70,
            "positionLayout": 60,
            "stability": 58
          }
        },
        {
          "practiceId": "practice-month-4",
          "sequence": 4,
          "assessedAt": "2026-08-11T10:00:00Z",
          "totalScore": 62,
          "dimensions": {
            "strokeStandard": 68,
            "frameStructure": 61,
            "glyphProportion": 70,
            "positionLayout": 58,
            "stability": 55
          }
        }
      ]
    }
  ]
}
